{
  "document": "problems",
  "fixture_name": "aoba-zakkaten-boki-practice",
  "fixture_version": "1.0.0",
  "disclaimer": {
    "synthetic": true,
    "unapproved_teaching_material": true,
    "expert_reviewed": false,
    "official_exam_reprint": false,
    "tax_or_legal_advice": false,
    "statement_ja": "これは合成された未承認の簿記練習問題20問である。専門家の監修を受けていない。現行税法、税率、法的助言、公式試験問題の転載ではない。架空の青葉雑貨店の数値例である。"
  },
  "continuity_model": "independent_problems_shared_setting",
  "continuity_ja": "20問は同じ架空商店の設定と勘定科目を共有するが、各問は独立である。前問の元帳残高を次問の期首に引き継がない。期首が必要な問は opening_balances にその問だけで完結して書く。",
  "currency": "JPY",
  "amount_rule": "integer_yen",
  "problem_count": 20,
  "problems": [
    {
      "id": "Q01",
      "stage": "cash_and_capital",
      "title": "現金の元入れ",
      "tags": [
        "cash",
        "capital"
      ],
      "continuity": "independent",
      "opening_note_ja": "期首残高は本問だけの与件である。他問の元帳や試算表からは引き継がない。空配列はその問の開始時点で全勘定がゼロであることを意味する。",
      "prompt_ja": "本問は他問から独立している。舞台は架空の青葉雑貨店、日付は架空の20X6年4月である。架空の店主・青葉あおばは 20X6-04-01 に事業用現金 600000 円を元入れした。期首残高はなく、全勘定ゼロから始める。元入れの仕訳を作り、転記後の元帳と残高試算表を答えなさい。",
      "opening_balances": [],
      "expected_entries": [
        {
          "entry_no": 1,
          "date": "20X6-04-01",
          "memo": "店主による現金の元入れ",
          "lines": [
            {
              "account_code": "101",
              "side": "debit",
              "amount": 600000
            },
            {
              "account_code": "301",
              "side": "credit",
              "amount": 600000
            }
          ]
        }
      ],
      "explanation_ja": "事業用の現金が増えるので現金を借方にする。店主からの元入れは負債でも売上でもなく資本の増加なので、資本金を貸方にする。",
      "expected_ledger": [
        {
          "account_code": "101",
          "account_name": "現金",
          "debit_total": 600000,
          "credit_total": 0,
          "balance_side": "debit",
          "balance": 600000
        },
        {
          "account_code": "301",
          "account_name": "資本金",
          "debit_total": 0,
          "credit_total": 600000,
          "balance_side": "credit",
          "balance": 600000
        }
      ],
      "expected_trial_balance": {
        "rows": [
          {
            "account_code": "101",
            "account_name": "現金",
            "debit": 600000,
            "credit": 0
          },
          {
            "account_code": "301",
            "account_name": "資本金",
            "debit": 0,
            "credit": 600000
          }
        ],
        "total_debit": 600000,
        "total_credit": 600000
      }
    },
    {
      "id": "Q02",
      "stage": "cash_and_capital",
      "title": "消耗品の現金購入",
      "tags": [
        "cash",
        "payment"
      ],
      "continuity": "independent",
      "opening_note_ja": "期首残高は本問だけの与件である。他問の元帳や試算表からは引き継がない。空配列はその問の開始時点で全勘定がゼロであることを意味する。",
      "prompt_ja": "本問は他問から独立している。舞台は架空の青葉雑貨店、日付は架空の20X6年4月である。期首は現金 600000 円（借方）と資本金 600000 円（貸方）だけである。20X6-04-02 に包装用の消耗品 15000 円を現金で買った。消耗品は消耗品費（費用）にする。仕訳と、転記後の元帳・残高試算表を答えなさい。",
      "opening_balances": [
        {
          "account_code": "101",
          "side": "debit",
          "amount": 600000
        },
        {
          "account_code": "301",
          "side": "credit",
          "amount": 600000
        }
      ],
      "expected_entries": [
        {
          "entry_no": 1,
          "date": "20X6-04-02",
          "memo": "消耗品の現金購入",
          "lines": [
            {
              "account_code": "551",
              "side": "debit",
              "amount": 15000
            },
            {
              "account_code": "101",
              "side": "credit",
              "amount": 15000
            }
          ]
        }
      ],
      "explanation_ja": "消耗品は購入時の費用なので消耗品費を借方にする。現金が減るので現金を貸方にする。資本金は元入れのまま動かない。",
      "expected_ledger": [
        {
          "account_code": "101",
          "account_name": "現金",
          "debit_total": 600000,
          "credit_total": 15000,
          "balance_side": "debit",
          "balance": 585000
        },
        {
          "account_code": "301",
          "account_name": "資本金",
          "debit_total": 0,
          "credit_total": 600000,
          "balance_side": "credit",
          "balance": 600000
        },
        {
          "account_code": "551",
          "account_name": "消耗品費",
          "debit_total": 15000,
          "credit_total": 0,
          "balance_side": "debit",
          "balance": 15000
        }
      ],
      "expected_trial_balance": {
        "rows": [
          {
            "account_code": "101",
            "account_name": "現金",
            "debit": 585000,
            "credit": 0
          },
          {
            "account_code": "301",
            "account_name": "資本金",
            "debit": 0,
            "credit": 600000
          },
          {
            "account_code": "551",
            "account_name": "消耗品費",
            "debit": 15000,
            "credit": 0
          }
        ],
        "total_debit": 600000,
        "total_credit": 600000
      }
    },
    {
      "id": "Q03",
      "stage": "cash_sales",
      "title": "現金売上",
      "tags": [
        "cash"
      ],
      "continuity": "independent",
      "opening_note_ja": "期首残高は本問だけの与件である。他問の元帳や試算表からは引き継がない。空配列はその問の開始時点で全勘定がゼロであることを意味する。",
      "prompt_ja": "本問は他問から独立している。舞台は架空の青葉雑貨店、日付は架空の20X6年4月である。期首は現金 200000 円（借方）と資本金 200000 円（貸方）だけである。20X6-04-03 に雑貨を現金 48000 円で販売した。売上原価の算定はしない。仕訳と、転記後の元帳・残高試算表を答えなさい。",
      "opening_balances": [
        {
          "account_code": "101",
          "side": "debit",
          "amount": 200000
        },
        {
          "account_code": "301",
          "side": "credit",
          "amount": 200000
        }
      ],
      "expected_entries": [
        {
          "entry_no": 1,
          "date": "20X6-04-03",
          "memo": "雑貨の現金売上",
          "lines": [
            {
              "account_code": "101",
              "side": "debit",
              "amount": 48000
            },
            {
              "account_code": "401",
              "side": "credit",
              "amount": 48000
            }
          ]
        }
      ],
      "explanation_ja": "現金が増えるので借方にする。販売の収益は売上の貸方にする。このセットでは売上原価を仕入から振り替えないので、売れたからといって仕入を貸方にしない。",
      "expected_ledger": [
        {
          "account_code": "101",
          "account_name": "現金",
          "debit_total": 248000,
          "credit_total": 0,
          "balance_side": "debit",
          "balance": 248000
        },
        {
          "account_code": "301",
          "account_name": "資本金",
          "debit_total": 0,
          "credit_total": 200000,
          "balance_side": "credit",
          "balance": 200000
        },
        {
          "account_code": "401",
          "account_name": "売上",
          "debit_total": 0,
          "credit_total": 48000,
          "balance_side": "credit",
          "balance": 48000
        }
      ],
      "expected_trial_balance": {
        "rows": [
          {
            "account_code": "101",
            "account_name": "現金",
            "debit": 248000,
            "credit": 0
          },
          {
            "account_code": "301",
            "account_name": "資本金",
            "debit": 0,
            "credit": 200000
          },
          {
            "account_code": "401",
            "account_name": "売上",
            "debit": 0,
            "credit": 48000
          }
        ],
        "total_debit": 248000,
        "total_credit": 248000
      }
    },
    {
      "id": "Q04",
      "stage": "cash_purchases",
      "title": "現金による仕入",
      "tags": [
        "cash",
        "purchases"
      ],
      "continuity": "independent",
      "opening_note_ja": "期首残高は本問だけの与件である。他問の元帳や試算表からは引き継がない。空配列はその問の開始時点で全勘定がゼロであることを意味する。",
      "prompt_ja": "本問は他問から独立している。舞台は架空の青葉雑貨店、日付は架空の20X6年4月である。期首は現金 300000 円（借方）と資本金 300000 円（貸方）だけである。20X6-04-04 に商品 70000 円を現金で仕入れた。三分法の仕入勘定で記録し、繰越商品への振替はしない。仕訳と、転記後の元帳・残高試算表を答えなさい。",
      "opening_balances": [
        {
          "account_code": "101",
          "side": "debit",
          "amount": 300000
        },
        {
          "account_code": "301",
          "side": "credit",
          "amount": 300000
        }
      ],
      "expected_entries": [
        {
          "entry_no": 1,
          "date": "20X6-04-04",
          "memo": "商品の現金仕入",
          "lines": [
            {
              "account_code": "501",
              "side": "debit",
              "amount": 70000
            },
            {
              "account_code": "101",
              "side": "credit",
              "amount": 70000
            }
          ]
        }
      ],
      "explanation_ja": "三分法では、仕入れた商品の原価を仕入の借方に記録する。現金払いは現金の貸方である。まだ販売していなくても、期末棚卸や繰越商品への振替はしない。",
      "expected_ledger": [
        {
          "account_code": "101",
          "account_name": "現金",
          "debit_total": 300000,
          "credit_total": 70000,
          "balance_side": "debit",
          "balance": 230000
        },
        {
          "account_code": "301",
          "account_name": "資本金",
          "debit_total": 0,
          "credit_total": 300000,
          "balance_side": "credit",
          "balance": 300000
        },
        {
          "account_code": "501",
          "account_name": "仕入",
          "debit_total": 70000,
          "credit_total": 0,
          "balance_side": "debit",
          "balance": 70000
        }
      ],
      "expected_trial_balance": {
        "rows": [
          {
            "account_code": "101",
            "account_name": "現金",
            "debit": 230000,
            "credit": 0
          },
          {
            "account_code": "301",
            "account_name": "資本金",
            "debit": 0,
            "credit": 300000
          },
          {
            "account_code": "501",
            "account_name": "仕入",
            "debit": 70000,
            "credit": 0
          }
        ],
        "total_debit": 300000,
        "total_credit": 300000
      }
    },
    {